{
  "schemaVersion": "1.0",
  "kind": "agentlas-super-ontology-causal-impact",
  "state": "export_only",
  "runtimePromotionAllowed": false,
  "defaultDecision": "counterfactual_required_before_state_change",
  "causalClaimTypes": [
    "correlation_only",
    "causal_hypothesis",
    "intervention",
    "counterfactual",
    "temporal_causal",
    "memory_intervention",
    "multi_agent_plan",
    "external_side_effect",
    "physical_or_train"
  ],
  "requiredChecks": [
    "intervention_target",
    "expected_outcomes",
    "adverse_outcomes",
    "counterfactual_checks",
    "observability",
    "reversibility",
    "blast_radius",
    "blocked_write_surfaces",
    "rollback_plan"
  ],
  "decisions": [
    "allow_read",
    "draft_only",
    "review_required",
    "shadow_required",
    "block"
  ],
  "researchBasis": [
    "causal_rag",
    "causal_counterfactual_rag",
    "counterfactual_benchmark",
    "causal_planning",
    "causal_memory_intervention",
    "structural_causal_model",
    "resilience_engineering",
    "systems_theory"
  ],
  "hardStops": [
    "correlation_as_causation",
    "retrieved_relation_as_action_permission",
    "missing_counterfactual_check",
    "missing_adverse_outcome",
    "missing_blast_radius",
    "missing_observability",
    "state_change_without_rollback",
    "physical_action_without_human_protocol",
    "training_without_consent_or_delete_path",
    "multi_agent_write_without_ordered_handoff"
  ]
}
